Fruit Snacks,Mott's Applesauce Cups No Sugar Added Variety Pack (36 ct/3.9 oz),,,0.00,$19.00,$0.00,,292301,,,,
Fruit Snacks,GoGo SqueeZ Organic Applesauce Variety Pack (24 pk/3.2 oz),,,0.00,$24.00,$0.00,,236793,,,,
Fruit Snacks,Mott's Fruit Flavored Snacks (90 ct/0.8 oz),,,0.00,$18.50,$0.00,,66002,,,,
Fruit Snacks,Welch's Mixed Fruit Snacks (90 ct/0.8 oz),,,0.00,$21.00,$0.00,,235070,,,,
Fruit Snacks,Dole Fruit Cups (36 ct/4 oz),,,0.00,$30.00,$0.00,,9324963,,,,
Fruit Snacks,Skittles Original Real Fruit Juice Fruit Snacks (42 ct),,,0.00,$18.00,$0.00,,328155,,,,
Fruit Snacks,Gushers Strawberry Splash and Tropical Flavor Fruit Snacks (42 ct/0.8 oz),,,0.00,$22.50,$0.00,,199179,,,,
Fruit Snacks,Fruit by the Foot Variety Pack (48 ct),,,0.00,$27.00,$0.00,,221506,,,,
Fruit Snacks,Fruit Roll-Ups (72 ct),,,0.00,$27.00,$0.00,,289124,,,,
Fruit Snacks,Sun Maid Raisin Seedless Bulk Pack (24 pk/12 oz),,,0.00,$96.00,$0.00,,1917525,,,,
Fruit Snacks,Fla-Vor-Ice Popsicle Freezer Bars Variety Pack (100 ct/1.5 oz),,,0.00,$16.00,$0.00,,B005LURDJK,,,,
Snacks,Ritz Original Crackers (18 Sleeves),,,0.00,$20.00,$0.00,,37154,,,,
Snacks,Ritz Bits Cheese Crackers (30 ct/1.5 oz),,,0.00,$20.00,$0.00,,148570,,,,
Snacks,Premium Original Saltine Crackers (12 Sleeves),,,0.00,$17.50,$0.00,,12464,,,,
Snacks,Keebler Club Cracker Snack Stacks (24 Sleeves),,,0.00,$14.00,$0.00,,68455,,,,
Snacks,Cheez-It White Cheddar Baked Snack Pack (45 ct/1.5 oz),,,0.00,$22.50,$0.00,,152630,,,,
Snacks,Cheez-It Whole Grain Bundle (175 ct/0.75 oz),,,0.00,$75.00,$0.00,,7612294,,,,
Snacks,Goldfish Crackers Sweet & Savory Variety Snack Packs (45 pk/1.5 oz),,,0.00,$26.00,$0.00,,93647,,,,
Snacks,Goldfish Whole Grain Pretzel Snacks (300 ct/0.75 oz),,,0.00,$96.00,$0.00,,6358444,,,,
Snacks,Lance Sandwich Crackers Variety Pack (36 ct),,,0.00,$20.00,$0.00,,31799,,,,
Snacks,Lance Sandwich Crackers Toasty Peanut Butter (40 ct),,,0.00,$18.00,$0.00,,321719,,,,
Snacks,Honey Maid Honey Graham Crackers (4 pk/14.4 oz),,,0.00,$17.00,$0.00,,19256,,,,
Snacks,Snack Pack Chocolate and Vanilla Pudding Variety Pack (36 ct/3.25 oz),,,0.00,$16.50,$0.00,,28058,,,,
Snacks,Snyder's Hanover Mini Pretzels (36 ct/0.92 oz),,,0.00,$14.00,$0.00,,26812,,,,
Snacks,Snack Factory Pretzel Crisps Original (26 oz),,,0.00,$13.00,$0.00,,32451,,,,
Snacks,Dot's Pretzels Original Flavor Seasoned Pretzels (35 oz),,,0.00,$18.50,$0.00,,304114,,,,
Snacks,Garden Veggie Straws Variety Snack Pack (30 ct/1 oz),,,0.00,$20.00,$0.00,,293641,,,,
Snacks,"Takis Fuego Spicy Rolled Tortilla Chips Multipack (46 ct/1 oz)
**DISCLAIMER: 2-3 MONTH EXPIRY",,,0.00,$24.50,$0.00,,252672,,,,
Snacks,Pringles Snack Stacks Variety Pack (48 ct),,,0.00,$31.00,$0.00,,68313,,,,
Snacks,"Wise Chips Grab & Snack Variety Pack (50 ct)
**DISCLAIMER: 2-3 MONTH EXPIRY",,,0.00,$25.00,$0.00,,12182,,,,
Snacks,Cape Cod Kettle Cooked Original Reduced Fat (24 ct/1 oz),,,0.00,$16.00,$0.00,,331574,,,,
Snacks,Pirate's Booty (40 ct/0.5 oz),,,0.00,$24.00,$0.00,,259142,,,,
Snacks,SkinnyPop Variety Pack (36 ct),,,0.00,$24.00,$0.00,,221172,,,,
Snacks,PopCorners Variety Pack (28 ct/1 oz),,,0.00,$21.00,$0.00,,338607,,,,
Snacks,Act II Butter Lovers Microwave Popcorn (32 ct/2.75 oz),,,0.00,$15.00,$0.00,,258916,,,,
Snacks,Pepperidge Farm Dark Chocolate Milano Cookies (20 pk/2 ea),,,0.00,$16.00,$0.00,,31439,,,,
Snacks,Goya Maria Cookies (10 Sleeves),,,0.00,$17.00,$0.00,,112430,,,,
Snacks,Tate's Bake Shop Chocolate Chip Cookies (4 pk/3.5 oz),,,0.00,$19.50,$0.00,,305838,,,,
Snacks,"Nabisco Cookies Variety Pack (Oreos, Chips Ahoy, Golden Oreo) (60 ct/2 ea)",,6,6.00,$22.50,$135.00,,69288,,,,
Snacks,Oreo Chocolate Sandwich Cookies (30 pk/2.4 oz),,,0.00,$22.50,$0.00,,71656,,,,
Snacks,Chips Ahoy Cookies Chocolate Chip (40 ct/1.55 oz),,,0.00,$30.00,$0.00,,1141051,,,,
Snacks,Famous Amos Chocolate Chip Cookies (42 ct/2 oz),,,0.00,$28.00,$0.00,,286097,,,,
Snacks,Newtons Soft & Chewy Fig Cookies Snack Packs (24 ct/2 ea),,,0.00,$19.50,$0.00,,34974,,,,
Snacks,Grandma’s Chocolate Chip Cookie (60 ct/2.5 oz),,,0.00,$50.00,$0.00,x,5734900,,,,
Snacks,Grandma’s Oatmeal Raisin Cookie (60 ct/2.5 oz),,,0.00,$50.00,$0.00,,5735121,,,,
Snacks,Grandma's Mini Vanilla Creme Cookie (60 ct/2.12 oz),,,0.00,$48.00,$0.00,,5714506,,,,
Snacks,Lorna Doone Shortbread Cookie (120 ct/1 oz),,,0.00,$53.00,$0.00,,8013021,,,,
Snacks,Darlington Soft Baked Short Bread Cookie (216 ct/.75 oz),,,0.00,$67.00,$0.00,,5015839,,,,
Snacks,"Nilla Wafers Cookies, Vanilla Wafer (2 pk/15 oz)",,,0.00,$17.00,$0.00,,12466,,,,
Snacks,Nutella & Go with Breadsticks (16 ct/1.8 oz),,,0.00,$25.00,$0.00,,128113,,,,
Snacks,Nonnis Cioccolati Biscotti (25 ct),,,0.00,$20.00,$0.00,,332618,,,,
Snacks,Keebler Whole Wheat Animal Crackers (150 ct/1 oz),,,0.00,$73.00,$0.00,,1007536,,,,
Snacks,Pop-Tarts Frosted Variety Pack (48 ct),,,0.00,$18.50,$0.00,,272741,,,,
Snacks,Kellogg's Special K Cereal Bars (60 ct/2 ea),,,0.00,$17.50,$0.00,,289833,,,,
Snacks,Rice Krispies Treats Original (60 ct),,6,6.00,$26.00,$156.00,,113638,,,,
Snacks,Nutri-Grain Bars Variety Pack (48 ct/1.3 oz),,,0.00,$26.00,$0.00,,12332,,,,
Snacks,Kind Snacks Minis Nut Bars Variety Pack (32 ct/0.7 oz),,,0.00,$28.00,$0.00,,171278,,,,
Snacks,Planters Roasted Salted Peanuts (144 ct/1 oz),,,0.00,$60.00,$0.00,,KOW000084,,,,
Snacks,Clif Kid ZBar Variety Pack with 2g Protein (36 ct/1.27 oz),,,0.00,$42.00,$0.00,,18462,,,,
Snacks,Jack Links Beef Jerky Variety Pack (9 ct/1.25 oz),,,0.00,$30.00,$0.00,,274187,,,,
Snacks,Chomps Grass-Fed and Finished Beef Jerky Snack Sticks (10 ct),,,0.00,$36.00,$0.00,,B07D3NS8NW,,,,
Snacks,Nature Valley Oats 'n Honey Granola Bars (49 ct/2 ea),,,0.00,$32.00,$0.00,,21137,,,,
Snacks,Nature Valley Fruit & Nut Trail Mix Chewy Granola Bars (48 ct/1.2 oz),,,0.00,$32.00,$0.00,,21139,,,,
Snacks,Nature Valley Peanut Butter Chocolate Protein Bars (26 ct),,,0.00,$30.00,$0.00,,41116,,,,
Snacks,Cracker Jack Popcorn (9 ct/8.5 oz),,,0.00,$27.00,$0.00,,6981518,,,,
Candy,Ghirardelli Chocolate Assorted Squares Bag (18.8 oz),,,0.00,$24.00,$0.00,,326304,,,,
Candy,Lindt Lindor Assorted Gold Bag (19 oz),,,0.00,$24.00,$0.00,,294585,,,,
Candy,Ferrero Rocher Fine Hazelnut Chocolates (48 ct),,,0.00,$28.00,$0.00,,20457,,,,
Candy,Toblerone Milk Chocolate Bars (6 ct/3.52 oz),,,0.00,$21.00,$0.00,,98576,,,,
Candy,York Snack Size Dark Chocolate Peppermint Patties (175 ct),,,0.00,$29.00,$0.00,,24925,,,,
Candy,Reese's Miniature Peanut Butter Cups (56 oz),,,0.00,$28.50,$0.00,,24375,,,,
Candy,"Snickers, Twix & More Minis Chocolate Candy Bars Variety Pack (200 ct)",,,0.00,$30.00,$0.00,,340338,,,,
Candy,"Hershey's, Kit Kat & Reese's Full Size Chocolate Candy Bars Variety Pack (30 pk/case)",,,0.00,$42.00,$0.00,,15441,,,,
Candy,"Snickers, Twix & More Chocolate Candy Bars, Full-Size Variety Pack (30 ct)",,,0.00,$42.00,$0.00,,19312,,,,
Candy,Twix Full Size Caramel Cookie Chocolate Candy Bars (36 ct/1.79 oz),,,0.00,$62.00,$0.00,,25270,,,,
Candy,Hershey's Full Size Milk Chocolate Candy Bars (36 pk/1.55 oz),,,0.00,$59.00,$0.00,,26671,,,,
Candy,Kit Kat Full Size Milk Chocolate Wafer Candy Bars (36 pk/1.5 oz),,,0.00,$59.00,$0.00,,26719,,,,
Candy,Skittles and Starburst Chewy Candy Full Size Assorted (30 ct),,,0.00,$42.00,$0.00,,226087,,,,
Candy,Swedish Fish Mini Soft & Chewy Candy Snack Packs (24 pk/2 oz),,,0.00,$34.00,$0.00,,11134,,,,
Candy,"Skittles, Starburst & Life Savers Fruity Candy Mini Variety Pack (150 ct)",,,0.00,$25.50,$0.00,,326370,,,,
Candy,Sour Patch Kids and Swedish Fish Mini Variety Pack (200 ct),,,0.00,$28.00,$0.00,,286591,,,,
Candy,Twizzler & Jolly Rancher Variety Pack (260 ct),,,0.00,$24.00,$0.00,,291740,,,,
Candy,Starburst Original Fruity Chewy Candy Bulk Jar (54 oz),,,0.00,$17.00,$0.00,,209156,,,,
Candy,Airheads Candy Bars Variety Pack (60 ct),,,0.00,$16.00,$0.00,,B0017L4PH0,,,,
Candy,Jolly Rancher Assorted Hard Candy (5 lbs),,,0.00,$24.00,$0.00,,12352,,,,
Candy,Werther's Original Caramel Hard Candies (30 oz),,,0.00,$16.00,$0.00,,296672,,,,
Candy,Spangler Dum Dums Original Pops (360 ct),,,0.00,$24.00,$0.00,,25736,,,,
Candy,Charms Blow Pop Assorted (100 ct),,,0.00,$21.00,$0.00,,131164,,,,
Candy,Tootsie Roll Favorites Variety Pack (4.75 lbs),,,0.00,$19.50,$0.00,,226479,,,,
Candy,Life Savers Wint O Blue Breath Mints Bulk Hard Candy (53.95 oz),,,0.00,$18.50,$0.00,,326024,,,,
Candy,Life Savers Wint O Green Breath Mints Bulk Hard Candy (53.95 oz),,,0.00,$18.50,$0.00,,292780,,,,
Candy,Ricola Sugar-free Lemon Mint Herb Throat Drops (130 ct),,,0.00,$17.00,$0.00,,326203,,,,
Candy,Ice Breakers Sugar-Free Cool Mints (8 pk/1.5 oz),,,0.00,$26.00,$0.00,,27908,,,,
Candy,Brachs Softmints Peppermint Carton,,,0.00,$25.00,$0.00,,339167,,,,
Hygiene,Colgate 360 Whole Mouth Clean Toothbrush (8 ct),,,0.00,$22.50,$0.00,,671849,,,,
Hygiene,"Travel Toothbrush Case Multicolor, Plastic (4 pk)",,,0.00,$11.50,$0.00,,B08PHZTXV3,,,,
Hygiene,Gum Crayola Neon Clean Children's Soft Toothbrush (8 ct),,,0.00,$13.00,$0.00,,339609,,,,
Hygiene,Oral-B Glide Dental Floss All-in-One (6 pk),,,0.00,$26.00,$0.00,,337110,,,,
Hygiene,Crest Pro-Health Advanced Multi-Benefit Toothpaste (5 ct/5.8 oz),,,0.00,$25.00,$0.00,,289272,,,,
Hygiene,Sensodyne Advanced Whitening Toothpaste for Sensitive Teeth and Cavity Protection (4 pk/6.5 oz),,,0.00,$46.50,$0.00,,335206,,,,
Hygiene,Colgate MaxFresh Cool Mint Toothpaste (5 pk/7.3 oz),,,0.00,$23.50,$0.00,,287479,,,,
Hygiene,Tom's of Maine Anticavity Kids Toothpaste Variety (3 pk/5.1 oz),,,0.00,$22.00,$0.00,,B0CYTK3DXR,,,,
Hygiene,ACT Kids Bubblegum Blowout Anti-Cavity Rinse (3 ct/16.9 oz),,,0.00,$17.00,$0.00,,30478,,,,
Hygiene,Crest Pro-Health Multi-Protection Mouthwash (3 pk/1L),,,0.00,$21.00,$0.00,,76380,,,,
Hygiene,Neutrogena Daily Makeup Remover Cleansing Wipes (107 ct),,,0.00,$26.00,$0.00,,339396,,,,
Hygiene,Cetaphil Gentle Skin Facial Cleanser (2 ct/20 oz),,,0.00,$39.50,$0.00,,282929,,,,
Hygiene,Neutrogena Oil-Free Salicylic Acid Acne Face Wash (2 pk/9.1 oz),,,0.00,$24.50,$0.00,,269191,,,,
Hygiene,Cetaphil Moisturizing Cream (2 pk/16 oz),,,0.00,$42.00,$0.00,,299833,,,,
Hygiene,Lubriderm Daily Moisture Advanced Therapy Lotion (3 pk),,,0.00,$25.50,$0.00,,224675,,,,
Hygiene,Aveeno Daily Moisturizing Body Lotion For Dry Skin (2 pk/18 fl. oz + 8oz Tube),,,0.00,$28.50,$0.00,,316928,,,,
Hygiene,Eucerin Intensive Repair Body Lotion (2 pk/16.9 oz),,,0.00,$29.00,$0.00,,316022,,,,
Hygiene,Dove Damage Therapy Shampoo (4 pk/12 oz),,,0.00,$31.00,$0.00,,B01INE0KAY,,,,
Hygiene,Dove Damage Therapy Conditioner (4 pk/12 oz),,,0.00,$31.00,$0.00,,B01INE0KWC,,,,
Hygiene,Dove Men+ Care Fortifying 2-in-1 Shampoo and Conditioner (4 pk/12 oz),,,0.00,$31.00,$0.00,,B01INE0P6I,,,,
Hygiene,Dove Beauty Bar White (16 ct),,,0.00,$29.50,$0.00,,244702,,,,
Hygiene,Dove Men + Care Extra Fresh Bar Soap (14 ct),,,0.00,$26.50,$0.00,,244799,,,,
Hygiene,Dove Deep Moisture Renewing Body Wash (3 pk/23 oz),,,0.00,$30.00,$0.00,,307427,,,,
Hygiene,Dove Men+ Care Body Wash (4 ct/18 oz),,,0.00,$46.00,$0.00,,B0837311RV,,,,
Hygiene,Dove Men+ Care Antiperspirant Deodorant Roll-on (4 pk/2.7 oz),,,0.00,$30.00,$0.00,,235380,,,,
Hygiene,Dove Men+ Care Antiperspirant Deodorant Dry Spray (3 pk/3.8 oz),,,0.00,$30.00,$0.00,,322355,,,,
Hygiene,Secret Invisible Solid Antiperspirant and Deodorant (5 pk),,,0.00,$24.00,$0.00,,323875,,,,
Hygiene,Dove Clear Finish Antiperspirant Spray (3 pk/4.8 oz),,,0.00,$32.00,$0.00,,248710,,,,
Hygiene,"Always Ultra Thin Daytime Pads with Wings, Size 1 Regular (3 pk/42 count)",,,0.00,$34.00,$0.00,,B0BG45ZMLB,,,,
Hygiene,"Always Pocket Pads with FlexFoam & Wings, Size 1 Regular (22 count)",,,0.00,$17.00,$0.00,,B0CP8NB26H,,,,
Hygiene,Tampax Pearl Unscented Tampons (96 ct),,,0.00,$30.00,$0.00,,699241,,,,
Hygiene,Dial Foaming Hand Wash Antibacterial & Moisturizing (4 pk/7.5 oz),,,0.00,$19.50,$0.00,,322510,,,,
Hygiene,Purell Prime Advanced Hand Sanitizer (4 pk/8 oz),,,0.00,$31.00,$0.00,,252335,,,,
Hygiene,Wet Ones Antibacterial Wipes Travel Pack (7 pk/20 Wipes),,,0.00,$22.50,$0.00,,295586,,,,
Hygiene,Vaseline Lip with Aloe Chapstick,,,0.00,$24.00,$0.00,,B09RY9XYLS,,,,
Hygiene,Vaseline Original Petroleum Jelly (2 pk/13 oz),,,0.00,$17.00,$0.00,,32140,,,,
Hygiene,Dove Moisturizing Hand Cream (4 ct/3 oz),,,0.00,$28.00,$0.00,,B09F5VKV65,,,,
Hygiene,Coppertone Sport Sunscreen Lotion SPF 50 (6 ct/3 fl. oz),,,0.00,$36.00,$0.00,,B09R5T36JX,,,,
Hygiene,Puffs Plus Lotion Facial Tissue (12 pk/56 sheets),,,0.00,$24.00,$0.00,,320770,,,,
Hygiene,Kleenex Trusted Care 2-Ply Facial Tissues (12 pk/160 sheets),,,0.00,$31.00,$0.00,,292796,,,,
Hygiene,Cottonelle Fresh Care Flushable Wet Wipes (12 pk),,,0.00,$26.00,$0.00,,247557,,,,
Hygiene,"Disposable Facial Mask - adult size (100 ct, Black)",,,0.00,$20.00,$0.00,,B09GNXJTKV,,,,
Hygiene,Pampers Swaddlers Ultra-Absorbent Baby Diapers - Size 5 (140 ct),,,0.00,$74.00,$0.00,,333291,,,,
Hygiene,Pampers Fresh Scent Baby Clean Wipes (15 pk/80 wipes),,,0.00,$42.00,$0.00,,339120,,,,
Hygiene,Huggies Snug & Dry Baby Diapers - Size 5 (186 ct),,,0.00,$79.00,$0.00,,342172,,,,
Hygiene,Nix Lice Treatment & Prevention Kit,,,0.00,$40.00,$0.00,,B0BH8KD8GN,,,,
Supplies,Pendaflex Letter-Size Hanging File Folders (25 pk),,,0.00,$22.00,$0.00,,B01MXC0YS5,,,,
Supplies,Energizer AA Alkaline Batteries (32 ct),,,0.00,$36.00,$0.00,,AP91DP-32,,,,
Supplies,Energizer AAA Alkaline Batteries (32 ct),,,0.00,$36.00,$0.00,,AP92DP-32,,,,
Supplies,Energizer D Alkaline Batteries (12 ct),,,0.00,$36.00,$0.00,,AP95DP-12,,,,
Supplies,Sharpie Assorted Tip Permanent Markers (21 ct),,,0.00,$20.00,$0.00,,324445,,,,
Supplies,EXPO Marker & Dry Erase Set,,,0.00,$26.00,$0.00,,727900,,,,
Supplies,Scotch Heavy Duty Shipping Packaging Tape with Dispenser (4 rolls),,,0.00,$24.50,$0.00,,172701,,,,
Supplies,"Post-it Super Sticky Notes 3"" x 3"" (24 ct/70 sheets)",,,0.00,$24.00,$0.00,,B01D8F5FKS,,,,
Supplies,Glad ForceFlex Tall Kitchen Trash Bags (120 ct/13 gal),,,0.00,$39.50,$0.00,,35596,,,,
Supplies,Swiffer Sweeper Dry and Wet Sweeping Kit,,,0.00,$26.50,$0.00,,331441,,,,
Supplies,O-Cedar EasyWring Microfiber Spin Mop,,,0.00,$64.00,$0.00,,B00WSWGVZQ,,,,
Supplies,Mr. Clean Extra Durable Scrub Magic Eraser Sponges (15 ct),,,0.00,$26.00,$0.00,,300336,,,,
Supplies,"Lysol Disinfectant Spray, Crisp Linen (3 pk/19 oz)",,,0.00,$26.50,$0.00,,259737,,,,
Supplies,Lysol All-Purpose Cleaner (4 ct/32 oz),,,0.00,$21.00,$0.00,,335207,,,,
Supplies,Lysol Advanced Disinfecting Wipes Variety Pack (5 pk/85 sheets),,,0.00,$26.00,$0.00,,337377,,,,
Supplies,Clorox Disinfecting Wipes Value Pack (5 pk/85 sheets),,,0.00,$31.50,$0.00,,241915,,,,
Supplies,Clorox Performance Bleach (3 pk/121 oz),,,0.00,$32.00,$0.00,,242552,,,,
Supplies,Clorox Ultra Clean Bleach Toilet Tablets (6 ct/3.5 oz),,,0.00,$24.00,$0.00,,629581,,,,
Supplies,Dawn Powerwash Fresh Dish Spray (64.5 fl. oz),,,0.00,$21.00,$0.00,,325476,,,,
Supplies,Scotch-Brite Lint Rollers (4 pk/420 sheets),,,0.00,$21.00,$0.00,,336678,,,,
Supplies,Bounty Select-A-Size Paper Towels (12 ct),,,0.00,$46.50,$0.00,,335416,,,,
Supplies,Gain Flings Detergent Pacs - 3in1 Original Scent (4 pk/38 ct),,,0.00,$46.50,$0.00,,265774,,,,
Supplies,Tide POD Laundry Detergent Pacs (4 pk/42 ct),,,0.00,$52.00,$0.00,,325553,,,,
Supplies,Gain Laundry Detergent Aroma Boost (2 pk/65 fl. oz),,,0.00,$24.50,$0.00,,B09NYM2K1P,,,,
Supplies,Gain Original Scent Dryer Sheets (2pk / 160 ct),,,0.00,$18.50,$0.00,,87208,,,,
Supplies,Snuggle Fabric Softener Dryer Sheet (320 ct),,,0.00,$18.50,$0.00,,227942,,,,
Supplies,Downy Ultra Soft Fabric Softener (2 ct/56 oz),,,0.00,$29.00,$0.00,,B07VFPPS3Z,,,,
Supplies,Febreze Fabric Extra Strength Spray with Downy Calm (2 pk),,,0.00,$17.00,$0.00,,336527,,,,
Supplies,Tide Oxi Pens Stain Remover (6 count),,,0.00,$22.00,$0.00,,B07K8YLNVK,,,,
Supplies,"Laundry Bag 28"" x 36"", Heavy Duty (2 bags; color may vary)",,,0.00,$22.00,$0.00,,B08TQXT7D8,,,,
Supplies,USB-C Phone Charger Block (3 ct/6 feet),,,0.00,$35.00,$0.00,,B0CF9WZXVW,,,,
Supplies,Power Strip Surge Protector (2 ct/5 feet),,,0.00,$38.00,$0.00,,B0B181NZ1Y,,,,
Supplies,Digital LED Alarm Clock: Basic Degit & USB Charging Port (Outlet & Battery Operated),,,0.00,$29.00,$0.00,,CR1001E,,,,
Supplies,Revlon Turbo Hair Dryer,,,0.00,$21.50,$0.00,,B003TQPRGY,,,,
Supplies,"17"" Diamond Patch Backpacks Assorted 8 Colors (24 ct)",,,0.00,$196.00,$0.00,,BAPA-300,,,,
Supplies,"17"" Basic Backpack in Black Color (24 ct)",,,0.00,$160.00,$0.00,,BAPA-351-24,,,,
Supplies,"42"" Umbrellas, Windproof and Compact for Teenagers (Black)",,,0.00,$15.00,$0.00,,B078PD34VG,,,,
Supplies,"Fleece Throw Blanket (50"" x 60"")",,,0.00,$24.00,$0.00,,B0157T1ZK2,,,,
Supplies,Drawstring Bag Bulk 10 Colors (100 ct),,,0.00,$150.00,$0.00,,B0BC1BCTXW,,,,
Supplies,"Multicolor Reusable Grocery Bags (24 pk/13.4"" x 10.2"" x 15"")",,,0.00,$48.00,$0.00,,B0CF8LJ84V,,,,
Supplies,Ziploc Storage Bag Variety Pack (347 ct),,,0.00,$24.50,$0.00,,35771,,,,
Supplies,Foldable Utility Cart with Swivel Wheels and Double Basket,,,0.00,$115.00,$0.00,,B09NW2975G,,,,
Supplies,"Cell Phone Locker (24 Slots, Aluminum)",,,0.00,$99.00,$0.00,,B0CZMR9C5T,,,,
Supplies,Waterproof Pencil Pouches - 12 Colors (24 ct),,,0.00,$24.00,$0.00,,B07PS25XP6,,,,
Supplies,First Aid Kit for 100 person (326 pieces),,,0.00,$65.00,$0.00,,B002DQY776,,,,
Supplies,Portable Emergency First Aid Kit (80 pieces),,,0.00,$21.00,$0.00,,B0B41MYSGP,,,,
Supplies,Insulated Stainless 17oz Water Bottle - Color May Vary,,,0.00,$21.00,$0.00,,B0C3B84WZ2,,,,
Supplies,Portable Handheld Turbo Fan Type-C (Green),,,0.00,$29.00,$0.00,,B0DHVHCWQG,,,,
Supplies,Methanol Gel Chafing Dish Fuel 2.5 Hours (72 ct),,,0.00,$72.00,$0.00,,174cgfm2,,,,
Supplies,BIC Multi-Purpose Lighter Set (4 ct),,,0.00,$16.00,$0.00,,14577,,,,
Supplies,Heavy Duty Stainless Steel Can Opener,,,0.00,$15.00,$0.00,,B09NXMDPS1,,,,
Supplies,Hot Hand Warmers Heat Pack,,,0.00,$42.00,$0.00,,B084RKP81T,,,,
Packaging,"Individually Wrapped Sporks (1,000 ct)",,,0.00,$29.00,$0.00,,KOW000133,,,,
Packaging,4 Piece Cutlery Packet (420 ct),,,0.00,$55.00,$0.00,,KOW000039,,,,
Packaging,"9"" Compostable ECO Plates (500 ct)",,,0.00,$55.00,$0.00,,KOW000038,,,,
Packaging,28oz Rectangular Microwavable Container and Lid (150 ct),,,0.00,$55.00,$0.00,,KOW000005,,,,
Packaging,Foil Pan Deep Full Size - LIDS SEPARATE (50 ct),,,0.00,$84.00,$0.00,,KOW000014,,,,
Packaging,Foil Pan Full Size Lids (50 ct),,,0.00,$64.00,$0.00,,KOW000013,,,,
Packaging,"Powder Free Vinyl Gloves (1,000 ct) - Small",,,0.00,$52.00,$0.00,,KOW000052,,,,
Packaging,"Powder Free Vinyl Gloves (1,000 ct) - Medium",,,0.00,$52.00,$0.00,,KOW000051,,,,
Packaging,"Powder Free Vinyl Gloves (1,000 ct) - Large",,,0.00,$52.00,$0.00,,KOW000050,,,,
Packaging,"Powder Free Vinyl Gloves (1,000 ct) - Extra Large",,,0.00,$52.00,$0.00,,KOW000053,,,,
Packaging,"1/8 Small Size White Unprinted T-shirt Bag (1,000 ct)",,,0.00,$42.00,$0.00,,433nht002,,,,
Packaging,"10 oz Hot Cup (1,000 ct)",,,0.00,$55.00,$0.00,,KOM003983,,,,
"Board Games
 - Strategy","Chess (Wooden, Foldable, Magentic)",,,0.00,$48.00,$0.00,,B07XQJH8MP,,,,
"Board Games
 - Strategy",Connect 4,,,0.00,$14.00,$0.00,,B00D8STBHY,,,,
"Board Games
 - Strategy",Mancala,,,0.00,$24.00,$0.00,,B001FA22DC,,,,
"Board Games
 - Strategy",Battleship,,,0.00,$24.00,$0.00,,B06Y1N3PTX,,,,
"Board Games
 - Strategy",Catan,,,0.00,$70.00,$0.00,,B0DYK1ZH2D,,,,
"Board Games
 - Strategy",Ticket to Ride,,,0.00,$77.00,$0.00,,B0F8PKN4B7,,,,
"Board Games
 - Strategy",Sequence,,,0.00,$26.00,$0.00,,B00000IVAK,,,,
"Board Games
 - Strategy",Checkers,,,0.00,$23.00,$0.00,,B0DRPTKXRD,,,,
"Board Games
 - Family",Candy Land Kingdom of Sweet Adventures,,,0.00,$24.00,$0.00,,B00000DMF5,,,,
"Board Games
 - Family",Trouble Game,,,0.00,$14.00,$0.00,,B00D7OAOYI,,,,
"Board Games
 - Family",The Game of Life,,,0.00,$31.00,$0.00,,B06XY48MK1,,,,
"Board Games
 - Family",Clue,,,0.00,$31.00,$0.00,,B0B5FLTTT5,,,,
"Board Games
 - Family",Guess Who?,,,0.00,$24.00,$0.00,,B08MVWB4SC,,,,
"Board Games
 - Family",Guess in 10 - Animal Planet,,,0.00,$28.00,$0.00,,B07RMJ8SG6,,,,
"Board Games
 - Family",Sorry!,,,0.00,$14.00,$0.00,,B076HK9H7Z,,,,
"Board Games
 - Family",Monopoly Classic,,,0.00,$28.00,$0.00,,B0DN37BBGD,,,,
"Board Games
 - Family",Dominoes,,,0.00,$12.00,$0.00,,B07JQ6ZX7Y,,,,
"Board Games 
- Word, Number, Cards",Upwords,,,0.00,$25.00,$0.00,,B0BRT5B6GC,,,,
"Board Games 
- Word, Number, Cards",Five Crowns - GIANT,,,0.00,$28.00,$0.00,,B0FB13P52Y,,,,
"Board Games 
- Word, Number, Cards",Exploding Kittens Original,,,0.00,$28.00,$0.00,,B010TQY7A8,,,,
"Board Games 
- Word, Number, Cards",Taco Cat Goat Cheese Pizza,,,0.00,$14.00,$0.00,,B077Z1R28P,,,,
"Board Games 
- Word, Number, Cards",Clumsy Thief Math Game,,,0.00,$30.00,$0.00,,B00EBCDXCA,,,,
"Board Games 
- Word, Number, Cards",Scrabble Classic,,,0.00,$31.00,$0.00,,B09D44JH4S,,,,
"Board Games 
- Word, Number, Cards",UNO,,,0.00,$17.00,$0.00,,B07P6MZPK3,,,,
"Board Games 
- Skill & Action",Jenga,,,0.00,$23.00,$0.00,,B00ABA0ZOA,,,,
"Board Games 
- Skill & Action",Don’t Break The Ice,,,0.00,$24.00,$0.00,,B01MS6B7BV,,,,
"Board Games 
- Skill & Action","The Sneaky, Snacky Squirrel Game",,,0.00,$31.00,$0.00,,B00486ZVC4,,,,
"Board Games 
- Skill & Action",Feed the Woozle,,,0.00,$34.00,$0.00,,B00L3DQ1B0,,,,
"Board Games 
- Skill & Action",Zingo! Bingo with a Zing,,,0.00,$36.00,$0.00,,B01DY818JG,,,,
"Board Games 
- Skill & Action",Spot It! Classic,,,0.00,$16.00,$0.00,,B08CMRPCKL,,,,
"Board Games 
- Skill & Action",Outfoxed!,,,0.00,$34.00,$0.00,,B00UB7P0XY,,,,
"Board Games 
- Skill & Action",Twister,,,0.00,$28.00,$0.00,,B008J87PVC,,,,
"Board Games 
- Skill & Action",Operation,,,0.00,$28.00,$0.00,,B00000DMFM,,,,
"Board Games 
- Skill & Action",Hungry Hungry Hippos,,,0.00,$28.00,$0.00,,B0C3DNT9W3,,,,
Puzzles,United States Puzzles for Kids (70 pieces),,,0.00,$28.00,$0.00,,B08Y1HQ9K5,,,,
Puzzles,World Shaped Jigsaw Puzzles (68 pieces),,,0.00,$38.00,$0.00,,B003F1E7K0,,,,
Puzzles,Rotating World Globe (8 inch),,,0.00,$40.00,$0.00,,B00RA25TCK,,,,
Puzzles,Wooden Mosaic Puzzle (370 pieces),,,0.00,$28.00,$0.00,,B088H5Z3NH,,,,
Puzzles,Tangram Wooden Puzzle for 60 Challenges,,,0.00,$19.00,$0.00,,B09HGD9VMH,,,,
Puzzles,Tangram Jigsaw Wooden Multicolor Puzzle (40 pieces),,,0.00,$15.00,$0.00,,B07GF9421C,,,,
Chips,"Frito Lay Classic Mix Variety Pack (50 ct/1 oz)
*DISCLAIMER: 1-2 MONTH EXPIRY",,,0.00,$35.00,$0.00,,290671,,,,
Chips,"Frito Lay Flavor Mix Variety Pack (50 ct/1 oz)
*DISCLAIMER: 1-2 MONTH EXPIRY",,,0.00,$35.00,$0.00,,290681,,,,
Custom,"Little Bites Chocolate Muffins (20 ct) 
*DISCLAIMER: 1 MONTH EXPIRY",,,0.00,$20.00,$0.00,,19142,,,,
Custom,"Little Bites Blueberry Muffins (20 ct) 
*DISCLAIMER: 1 MONTH EXPIRY",,,0.00,$20.00,$0.00,,19143,,,,
Fee,Custom Kit Fee (Box. Up To 30 Pieces),,,0.00,$3.50,$0.00,,,,,,
Fee,Custom Kit Fee (Drawstring Bag. Up To 30 Pieces),,,0.00,$5.00,$0.00,,,,,,
Fee,Custom Kit Fee (Box. More Than 30 Pieces),,,0.00,$5.00,$0.00,,,,,,
Fee,Custom Kit Fee (Drawstring Bag. More Than 30 Pieces),,,0.00,$6.50,$0.00,,,,,,
"Christmas
: Candy Cane",Candy Canes Mini (260 ct),,,0.00,$21.00,$0.00,,227021,,,,
"Christmas
: Candy Cane",Candy Canes 3 Flavors (100 ct),,,0.00,$62.00,$0.00,,B0CL59W29Y,**changed from 150 ct to 100 ct due to supply,,,
"Christmas
: Candy Cane",Brach's Softmints Peppermint (350 ct),,,0.00,$24.00,$0.00,,339167,,,,
"Christmas
: Smores",Hershey's Milk Chocolate Bars (10 ct),,,0.00,$17.00,$0.00,,28446,,,,
"Christmas
: Chocolate",Ghirardelli Squares Pepperint Bark (1 lb),,,0.00,$20.00,$0.00,,76382,,,,
"Christmas
: Chocolate",Ghirardelli Snowmen Assorted Bag (15 oz),,,0.00,$20.00,$0.00,,307647,,,,
"Christmas
: Gingerbread House",Christmas Sprinkles (1.7 lbs),,,0.00,$35.00,$0.00,,B09VQRW24D,,,,
"Christmas
: Gingerbread House","Icing Red, White, Blue (3 ct/7 oz)",,,0.00,$25.00,$0.00,,B0F3542526,,,,
"Christmas
: Chocolate",Lindt Assorted Chocolate & Peppermint Snowflakes (43 ct),,,0.00,$20.00,$0.00,,345116,,,,
"Christmas
: Chocolate",Lindt Holiday Peppermint Duo Bag (19 oz),,,0.00,$19.00,$0.00,,295122,,,,
"Christmas
: Gingerbread House","Gingerbread House Kit (2 ct) 
**WHILE SUPPLIES LAST. CANNOT GUARANTEE AGAINST BROKEN KITS. BRAND MIGHT VARY",,,0.00,$17.00,$0.00,,346664,,,,
"Christmas
: Candy","Marshmallow, Mini (12 ct/1 lb)",,,0.00,$28.00,$0.00,,60764,,,,
"Christmas
: Candy","Marshmallow, Regular (12 ct/1 lb)",,,0.00,$32.00,$0.00,,61168,,,,
"Christmas
: Cookies",Grandma's Chocolate Chip Cookie - 2 Cookies per unit (60 ct/2.5 oz),,,0.00,$49.00,$0.00,,5734900,,,,
"Christmas
: Cookies",Grandma's Oatmeal Raisin Cookie - 2 Cookies per unit (60 ct/2.5 oz),,,0.00,$49.00,$0.00,,5735121,,,,
"Christmas
: Cookies",Grandma's Mini Vanilla Creme Cookies (60 ct/2.12 oz),,,0.00,$49.00,$0.00,,5714506,,,,
"Christmas
: Cookies",Cracker Jack Caramel Popcorn (9 ct/8.5 oz),,,0.00,$27.00,$0.00,,6981518,,,,
"Christmas
: Cookies",Darlington Farms Sugar Cookie Wrapped (216 ct/.75 oz),,,0.00,$66.00,$0.00,,5015839,,,,
"Christmas
: Cookies",Lorna Doone Shortbread Cookie - 4 Cookies per unit (120 ct),,,0.00,$45.00,$0.00,,8013021,,,,
"Christmas
: Cookies",Belvita Breakfast Bars Biscuits Gingerbread (25 ct/1.76 oz),,,0.00,$20.00,$0.00,,345320,,,,
"Christmas
: Cookies",Tate's Bake Shop Gingersnap Cookies (13 oz),,,0.00,$13.00,$0.00,,345724,,,,
"Christmas
: Chocolate",Desobry Belgian Chocolate Cookie Assortment (80 ct),,,0.00,$19.00,$0.00,,296062,,,,
"Christmas
: Shelf Stable",Domino Dark Brown Sugar (24 ct/1 lb),,,0.00,$49.00,$0.00,,3002276,,,,
"Christmas
: Protein","Chicken, Roaster Oven Stuffer Frozen ~7-8LB (9 ct)",,,0.00,$190.00,$0.00,,KOM001935,,,,
"Christmas
: K-cup",Mott's Hot Apple Cider K-Cup (96 ct),,,0.00,$84.00,$0.00,,B08BPCDHT5,,,,
"Christmas
: K-cup",The Original Donut Shop Peppermint Bark Light Roast K-Cup (96 ct),,,0.00,$98.00,$0.00,,B07PKPNXP1,,,,
"Christmas
: K-cup",Dunkin’ Medium Roast S’mores Flavored Coffee K-Cup (60 ct),,,0.00,$67.00,$0.00,,B0CLWCJQ1B,,,,
